{
  "type": "IntentCard",
  "version": "0.1",
  "id": "intent_compliance_001",
  "actor": {
    "type": "project",
    "id": "https://example.org/projects/openintent-demo",
    "name": "OpenIntent Demo Project"
  },
  "intent": {
    "summary": "Find implementation support for OpenIntent protocol validation",
    "category": "collaboration.protocol",
    "constraints": [
      {
        "field": "protocol_version",
        "operator": "equals",
        "value": "0.1",
        "required": true,
        "description": "Implementation must handle OpenIntent v0.1 objects."
      }
    ],
    "preferences": [
      {
        "field": "dependency_free",
        "value": true,
        "weight": 0.6,
        "description": "Prefer implementations that can run locally without network services."
      }
    ]
  },
  "consent": {
    "visibility": "public",
    "can_store": true,
    "can_forward": false,
    "can_contact_matches": false,
    "requires_human_approval": true
  }
}
